{
  "$schema": "../../../.bicameral/factory-latest/release-v0.1.12/schemas/runtime-architecture-contract.schema.json",
  "schema_version": 1,
  "spec_id": "RUNTIME-SPEC-PRODUCT-CREATION-DISCOVERY",
  "title": "Runtime Architecture: Product Creation and Discovery",
  "components": [
    {
      "id": "ELM-OPERATOR",
      "c4_kind": "person",
      "name": "Signed-in operator",
      "responsibility": "Chooses the Product name, event-store substrate, provider resource, and authorizes provider access.",
      "process_boundary": "Human interaction",
      "repository_runtime": "Browser user",
      "deployment_location": "Operator workstation",
      "authority_role": "Intent and consent authority",
      "inputs": ["Product creation form", "provider consent screen", "recovery actions"],
      "outputs": ["CreateProductIntent", "provider consent", "resource selection"],
      "state_ids": [],
      "multiplicity": "One initiating operator per creation attempt",
      "prohibited_authority": ["May not directly write canonical Product events", "May not make Cloud directory data canonical"]
    },
    {
      "id": "ELM-HOSTED-SPA",
      "c4_kind": "container",
      "name": "Hosted dashboard SPA",
      "responsibility": "Runs the staged creation experience including its embedded shared-backend connection step, preserves draft state, and renders discovery and recovery actions.",
      "process_boundary": "Browser process",
      "repository_runtime": "bicameral-bot dashboard",
      "deployment_location": "Cloud-served browser bundle",
      "authority_role": "Intent collector and derived-state renderer",
      "inputs": ["Cloud identity", "Cloud discovery projection", "daemon bridge outcomes", "connection readiness"],
      "outputs": ["provider connection commands", "product.create command", "Cloud publication command", "continue-setup command"],
      "state_ids": ["STATE-CREATION-DRAFT", "STATE-DISCOVERY-PROJECTION"],
      "multiplicity": "One or more browser sessions per operator",
      "prohibited_authority": ["Must not mint Product identity", "Must not persist provider secrets", "Must not infer event-store routing from current working directory"]
    },
    {
      "id": "ELM-CLOUD",
      "c4_kind": "software_system",
      "name": "Bicameral Cloud",
      "responsibility": "Authenticates the operator and persists non-canonical Product directory publication.",
      "process_boundary": "Hosted service",
      "repository_runtime": "bicameral-cloud",
      "deployment_location": "Hosted Cloud runtime and Supabase",
      "authority_role": "Identity authority for Cloud account and non-canonical directory writer",
      "inputs": ["ProductPublication authorized by ProductCreationCommitProof", "authenticated discovery query"],
      "outputs": ["Cloud actor context", "HostedProjectPreview collection"],
      "state_ids": ["STATE-CLOUD-PUBLICATION"],
      "multiplicity": "Many tenants and Products",
      "prohibited_authority": ["Must not write canonical Product settings or events", "Must not receive provider tokens or local paths"]
    },
    {
      "id": "ELM-BRIDGE",
      "c4_kind": "component",
      "name": "Hosted local-daemon bridge",
      "responsibility": "Authenticates and transports typed browser-to-daemon commands without becoming Product authority.",
      "process_boundary": "Cloud rendezvous plus browser-to-daemon session",
      "repository_runtime": "bicameral-cloud and bicameral-bot gateway",
      "deployment_location": "Hosted and operator-local runtimes",
      "authority_role": "Authenticated transport",
      "inputs": ["HostedHandoffEnvelope", "typed Product commands"],
      "outputs": ["HostedActorContext", "typed command outcomes"],
      "state_ids": [],
      "multiplicity": "One active paired session per browser/daemon pairing",
      "prohibited_authority": ["Must not select an event store", "Must not treat transport success as Product creation"]
    },
    {
      "id": "ELM-DAEMON",
      "c4_kind": "container",
      "name": "Local Bicameral daemon",
      "responsibility": "Validates actor authority, provider/resource readiness, explicit Product routing, canonical creation, registration, and replay.",
      "process_boundary": "Operator-local daemon process",
      "repository_runtime": "bicameral-bot Rust runtime and gateway",
      "deployment_location": "Operator workstation",
      "authority_role": "Canonical Product command handler and local registration writer",
      "inputs": ["HostedActorContext", "CreateProductIntent", "connection metadata", "event-store descriptor"],
      "outputs": ["CreateProduct receipt", "ProductCreationCommitProof", "ProductPublication", "ProjectRegistrationReceipt", "readiness projection"],
      "state_ids": ["STATE-CANONICAL-PRODUCT", "STATE-FIRST-EVENT-COMMIT-PROOF", "STATE-PROJECT-REGISTRATION"],
      "multiplicity": "One daemon may route many Products to many adapter instances",
      "prohibited_authority": ["Must not use process current adapter when explicit Product routing is absent", "Must not report Ready before registration and replay succeed"]
    },
    {
      "id": "ELM-CONNECTIONS",
      "c4_kind": "component",
      "name": "Operator connection service",
      "responsibility": "Starts provider authentication, stores secrets locally, and exposes non-secret operator-level readiness.",
      "process_boundary": "Local daemon component",
      "repository_runtime": "bicameral-bot gateway and bicameral-config",
      "deployment_location": "Operator workstation",
      "authority_role": "Provider credential and connection-readiness authority",
      "inputs": ["connection start/callback/status commands", "provider OAuth response"],
      "outputs": ["ConnectionMetadata", "redacted connection outcomes"],
      "state_ids": ["STATE-CONNECTION"],
      "multiplicity": "One operator registry with many provider connections",
      "prohibited_authority": ["Must not become Product membership or event-store selection", "Must not persist registry metadata under a Product workspace"]
    },
    {
      "id": "ELM-PROVIDER",
      "c4_kind": "software_system",
      "name": "GitHub or Google",
      "responsibility": "Authenticates the operator and authorizes access to a selected repository or Drive folder.",
      "process_boundary": "External provider",
      "repository_runtime": "GitHub OAuth/device flow or Google OAuth",
      "deployment_location": "Provider-hosted",
      "authority_role": "Provider identity and resource-access authority",
      "inputs": ["OAuth/device authorization request"],
      "outputs": ["authorization outcome", "resource metadata"],
      "state_ids": [],
      "multiplicity": "One or more provider accounts and resources",
      "prohibited_authority": ["Must not mint Bicameral Product identity", "Must not receive Cloud membership or Decision Ledger data"]
    },
    {
      "id": "ELM-EVENT-STORE",
      "c4_kind": "datastore",
      "name": "Selected Product event store",
      "responsibility": "Persists canonical Product creation, settings, membership, and accepted events through the selected adapter.",
      "process_boundary": "Git repository or Drive folder adapter boundary",
      "repository_runtime": "EventStoreAdapter implementation",
      "deployment_location": "Selected GitHub repository or Google Drive folder",
      "authority_role": "Canonical persistence substrate",
      "inputs": ["validated canonical Product events"],
      "outputs": ["provider-confirmed append receipt", "replayed canonical Product history"],
      "state_ids": ["STATE-CANONICAL-PRODUCT", "STATE-FIRST-EVENT-COMMIT-PROOF"],
      "multiplicity": "One explicitly addressed adapter/resource per Product; many per daemon",
      "prohibited_authority": ["Must not be selected from working directory or an unrelated active adapter", "Must not persist provider credentials"]
    }
  ],
  "relationships": [
    {
      "id": "REL-OPERATOR-SPA",
      "source_id": "ELM-OPERATOR",
      "destination_id": "ELM-HOSTED-SPA",
      "interaction": "Enter name, choose substrate/resource, and invoke create or recovery",
      "medium": "Browser UI",
      "handoff": "Synchronous interaction with browser-local draft persistence",
      "state_ids": ["STATE-CREATION-DRAFT", "STATE-DISCOVERY-PROJECTION"],
      "payloads": ["CreateProductIntent"],
      "authority_boundaries": ["Human intent to browser orchestration"]
    },
    {
      "id": "REL-SPA-CLOUD",
      "source_id": "ELM-HOSTED-SPA",
      "destination_id": "ELM-CLOUD",
      "interaction": "Read Cloud identity/directory and publish safe Product preview",
      "medium": "Authenticated HTTPS",
      "handoff": "Synchronous request over independently durable Cloud storage",
      "state_ids": ["STATE-CLOUD-PUBLICATION", "STATE-DISCOVERY-PROJECTION"],
      "payloads": ["ProductCreationCommitProof reference", "ProductPublication", "HostedProjectPreview"],
      "authority_boundaries": ["Browser to hosted tenant boundary", "Canonical-to-non-canonical projection boundary"]
    },
    {
      "id": "REL-SPA-BRIDGE",
      "source_id": "ELM-HOSTED-SPA",
      "destination_id": "ELM-BRIDGE",
      "interaction": "Send typed connection, creation, and continuation commands",
      "medium": "Hosted bridge protocol",
      "handoff": "Authenticated synchronous command/response",
      "state_ids": [],
      "payloads": ["CreateProductIntent", "product.continue_setup", "connection commands"],
      "authority_boundaries": ["Browser to operator-local trust boundary"]
    },
    {
      "id": "REL-BRIDGE-DAEMON",
      "source_id": "ELM-BRIDGE",
      "destination_id": "ELM-DAEMON",
      "interaction": "Deliver typed commands with daemon-confirmed actor context",
      "medium": "Local gateway dispatch",
      "handoff": "Synchronous dispatch; idempotency survives transport retry",